{
  "approval_version": "1.0.0",
  "approval_id": "replace-with-immutable-approval-id",
  "scope": "judge-qualification",
  "status": "failed",
  "independent": false,
  "qualification_sha256": "0000000000000000000000000000000000000000000000000000000000000000",
  "approver_id": "UNASSIGNED",
  "approver_qualification_evidence": "UNAVAILABLE",
  "conflicts": "NOT-ASSESSED",
  "decision_rationale": "Template only; it must fail until an accountable independent review is completed.",
  "approved_at": "1970-01-01T00:00:00Z",
  "expires_at": "1970-01-01T00:00:00Z"
}
